{
  "$schema": "https://json-schema.org/draft/2020-12/schema",
  "$id": "https://natlang.dev/schema/package-manifest-v2.json",
  "title": "natlang native package manifest",
  "type": "object",
  "required": [
    "schema",
    "name",
    "version",
    "include"
  ],
  "additionalProperties": false,
  "properties": {
    "schema": {
      "const": "natlang.package/v2"
    },
    "name": {
      "type": "string",
      "pattern": "^(?:@[a-z0-9][a-z0-9._-]*/)?[a-z0-9][a-z0-9._-]*$"
    },
    "version": {
      "type": "string",
      "pattern": "^[0-9]+\\.[0-9]+\\.[0-9]+(?:-[0-9A-Za-z.-]+)?$"
    },
    "description": {
      "type": "string",
      "minLength": 1
    },
    "include": {
      "type": "array",
      "minItems": 1,
      "uniqueItems": true,
      "items": {
        "$ref": "#/$defs/path"
      }
    },
    "exports": {
      "type": "object",
      "additionalProperties": {
        "$ref": "#/$defs/path"
      }
    },
    "dependencies": {
      "type": "object",
      "additionalProperties": {
        "type": "string",
        "minLength": 1
      }
    },
    "engines": {
      "type": "object",
      "additionalProperties": false,
      "properties": {
        "natlang": {
          "type": "string"
        },
        "node": {
          "type": "string"
        }
      }
    },
    "targets": {
      "type": "object",
      "additionalProperties": {
        "type": "object",
        "required": [
          "entry"
        ],
        "additionalProperties": false,
        "properties": {
          "entry": {
            "$ref": "#/$defs/path"
          },
          "adaptation": {
            "$ref": "#/$defs/path"
          },
          "export": {
            "type": "string",
            "minLength": 1
          },
          "description": {
            "type": "string",
            "minLength": 1
          },
          "authority": {
            "type": "array",
            "uniqueItems": true,
            "items": {
              "type": "string",
              "minLength": 1
            }
          },
          "commands": {
            "type": "array",
            "uniqueItems": true,
            "items": {
              "type": "string",
              "minLength": 1
            }
          }
        }
      }
    },
    "recording": {
      "type": "object",
      "additionalProperties": false,
      "description": "What the runtime records of this program's calls: definitions (a source glob such as auth/*.nl) or arguments (functionName.argument) recorded by type only.",
      "properties": {
        "exclude": {
          "type": "array",
          "items": {
            "type": "string",
            "minLength": 1
          }
        }
      }
    },
    "specialization": {
      "enum": [
        "off",
        "shadow",
        "on"
      ],
      "description": "How far stored compilations may serve this program's calls; the machine setting still bounds it."
    },
    "model": {
      "type": "object",
      "additionalProperties": false,
      "description": "The model the program is built, warmed and run with unless the command or environment selects one (natlang build writes it into .natlang/build/natlang.lock.json): a machine profile by name, a stock model (ts-host/src/model-catalog.ts), an OpenAI-compatible endpoint or a Pi provider model, with request and slot settings.",
      "properties": {
        "profile": {
          "type": "string",
          "minLength": 1
        },
        "stock": {
          "type": "string",
          "minLength": 1
        },
        "provider": {
          "type": "string",
          "minLength": 1
        },
        "model": {
          "type": "string",
          "minLength": 1
        },
        "endpoint": {
          "type": "string",
          "minLength": 1
        },
        "escalate": {
          "type": "string",
          "minLength": 1
        },
        "request": {
          "type": "object"
        },
        "contextTokens": {
          "type": "integer",
          "minimum": 1
        },
        "parallel": {
          "type": "integer",
          "minimum": 1
        }
      }
    },
    "warmup": {
      "type": "array",
      "description": "Calls natlang build --warm runs ahead of time with tracing; the prompt prefixes they send are prefilled and saved for natlang run.",
      "items": {
        "type": "object",
        "additionalProperties": false,
        "required": [
          "function",
          "inputs"
        ],
        "properties": {
          "name": {
            "type": "string",
            "minLength": 1
          },
          "function": {
            "$ref": "#/$defs/path",
            "description": "A .nl file of the package."
          },
          "inputs": {
            "type": "object",
            "description": "Arguments by parameter name."
          }
        }
      }
    }
  },
  "$defs": {
    "path": {
      "type": "string",
      "minLength": 1,
      "pattern": "^(?!/)(?!.*(?:^|/)\\.\\.(?:/|$))(?!.*\\\\).+$"
    }
  }
}
